{
  "id": "browsecomp",
  "name": "BrowseComp",
  "full_name": "BrowseComp: A Simple Yet Challenging Benchmark for Browsing Agents",
  "layer": "agent",
  "released": "2025-04",
  "maintainer": "OpenAI (Wei et al.)",
  "description": "1,266 human-written questions whose short, verifiable answers can only be found by persistently browsing many web pages and combining entangled constraints; human trainers verified that other people could not answer them within ten minutes and that then-current models failed. Scored as accuracy against the reference answer via a grader. It isolates deep web-research persistence rather than latent knowledge, so it separates browsing agents sharply.",
  "domains": [
    "web",
    "tool-use",
    "factuality",
    "reasoning"
  ],
  "metric": {
    "name": "accuracy",
    "unit": "percent",
    "higher_is_better": true
  },
  "task_count": 1266,
  "status": "saturating",
  "contamination_risk": "medium",
  "human_baseline": null,
  "supersedes": null,
  "superseded_by": null,
  "links": {
    "paper": "https://arxiv.org/abs/2504.12516",
    "website": "https://openai.com/index/browsecomp/",
    "leaderboard": null,
    "dataset": "https://github.com/openai/simple-evals",
    "code": "https://github.com/openai/simple-evals"
  },
  "notes": "No official leaderboard; numbers are vendor self-reports collected by aggregators, and browsing budget, search backend and parallel-sampling settings are rarely disclosed. Questions and encrypted answers are public in simple-evals. Top frontier scores are now clustered above 90%."
}
