{
  "id": "osworld",
  "name": "OSWorld",
  "full_name": "OSWorld: Benchmarking Multimodal Agents for Open-Ended Tasks in Real Computer Environments",
  "layer": "agent",
  "released": "2024-04",
  "maintainer": "XLANG Lab, University of Hong Kong (Xie et al.)",
  "description": "369 real computer-use tasks in a live Ubuntu VM spanning Chrome, LibreOffice, GIMP, VLC, VS Code, Thunderbird, OS file operations and multi-app workflows. Agents see screenshots (and optionally the accessibility tree), emit mouse/keyboard actions, and are scored by execution-based checkers on the final machine state. The standard benchmark for GUI computer-use agents; OSWorld-Verified (July 2025) fixed 300+ task issues and is the basis of the current official leaderboard.",
  "domains": [
    "computer-use",
    "multimodal",
    "tool-use"
  ],
  "metric": {
    "name": "success rate",
    "unit": "percent",
    "higher_is_better": true
  },
  "task_count": 369,
  "splits": [
    {
      "name": "original",
      "task_count": 369,
      "note": "April 2024 task set and evaluators, pre-Verified fixes."
    },
    {
      "name": "verified",
      "task_count": 369,
      "note": "OSWorld-Verified (July 2025): fixed evaluators, AWS infrastructure; 8 Google Drive tasks may be excluded (361 tasks). Official results at 15/50/100 max steps."
    }
  ],
  "status": "active",
  "contamination_risk": "medium",
  "human_baseline": {
    "value": 72.36,
    "population": "human computer users (paper)",
    "source": "https://arxiv.org/abs/2404.07972"
  },
  "supersedes": null,
  "superseded_by": null,
  "links": {
    "paper": "https://arxiv.org/abs/2404.07972",
    "website": "https://os-world.github.io",
    "leaderboard": "https://os-world.github.io",
    "dataset": "https://github.com/xlang-ai/OSWorld/tree/main/evaluation_examples",
    "code": "https://github.com/xlang-ai/OSWorld"
  },
  "notes": "Official 'Verified' leaderboard rows are run by the XLANG team under unified settings (source: static/data/osworld_verified_results.xlsx on the site); self-reported rows are listed separately. Scores depend strongly on the max-step budget, so compare within the same budget. Task configs and evaluators are public, but live-environment execution limits memorisation. OSWorld 2.0 (June 2026) is a separate successor not tracked here."
}
